{
  "$schema": "./zod-api.schema.json",
  "name": "Zod API Knowledge Base",
  "language": "zh-CN",
  "updated_at": "2026-04-29",
  "sources": [
    "https://github.com/colinhacks/zod",
    "https://zod.dev/api"
  ],
  "scope_note": "本文件聚焦 zod 在 JS-Slash-Runner / MVU 项目里实际会用到的语法和结构：定义 schema、解析、推断类型、组合、错误处理。zod 已经在 JS-Slash-Runner 内置（全局变量 z），通常不需要再安装。",
  "runtime": {
    "global": "z",
    "import_in_node_project": "import { z } from 'zod';",
    "version_note": "zod v3 与 v4 的根类大体一致；本知识库只列稳定 API。",
    "concepts": {
      "schema": "z.* 返回的对象。所有 schema 都有 parse / safeParse / parseAsync 等方法。",
      "type_inference": "type T = z.infer<typeof MySchema>;",
      "input_output": "z.input / z.output 区分 transform/preprocess 前后的类型。"
    }
  },
  "primitives": [
    { "name": "z.string", "signature": "z.string()", "modifiers": ["min", "max", "length", "regex", "email", "url", "uuid", "trim", "toLowerCase", "toUpperCase"] },
    { "name": "z.number", "signature": "z.number()", "modifiers": ["int", "min", "max", "positive", "negative", "nonpositive", "nonnegative", "multipleOf", "finite", "safe"] },
    { "name": "z.bigint", "signature": "z.bigint()" },
    { "name": "z.boolean", "signature": "z.boolean()" },
    { "name": "z.date", "signature": "z.date()" },
    { "name": "z.null", "signature": "z.null()" },
    { "name": "z.undefined", "signature": "z.undefined()" },
    { "name": "z.unknown", "signature": "z.unknown()" },
    { "name": "z.any", "signature": "z.any()" },
    { "name": "z.never", "signature": "z.never()" },
    { "name": "z.void", "signature": "z.void()" },
    { "name": "z.nan", "signature": "z.nan()" }
  ],
  "literals_and_enums": [
    { "name": "z.literal", "signature": "z.literal(value)", "example": "z.literal('male')" },
    { "name": "z.enum", "signature": "z.enum([...])", "example": "z.enum(['system', 'user', 'assistant'])" },
    { "name": "z.nativeEnum", "signature": "z.nativeEnum(EnumLike)" }
  ],
  "containers": [
    {
      "name": "z.object",
      "signature": "z.object({ key: z.* })",
      "example": "z.object({ name: z.string(), age: z.number().int().min(0) })",
      "modifiers": ["partial", "deepPartial", "required", "pick", "omit", "extend", "merge", "passthrough", "strict", "strip", "catchall", "shape", "keyof"]
    },
    {
      "name": "z.array",
      "signature": "z.array(item)",
      "example": "z.array(z.string()).min(1).max(10)"
    },
    {
      "name": "z.tuple",
      "signature": "z.tuple([z.string(), z.number()])",
      "example": "z.tuple([z.literal('_.set'), z.string(), z.any(), z.any()])"
    },
    {
      "name": "z.record",
      "signature": "z.record(keySchema?, valueSchema)",
      "example": "z.record(z.string(), z.unknown())"
    },
    {
      "name": "z.map",
      "signature": "z.map(keySchema, valueSchema)"
    },
    {
      "name": "z.set",
      "signature": "z.set(itemSchema)"
    }
  ],
  "compositions": [
    { "name": "z.union", "signature": "z.union([a, b])" },
    { "name": "z.discriminatedUnion", "signature": "z.discriminatedUnion('type', [a, b])" },
    { "name": "z.intersection", "signature": "z.intersection(a, b)" },
    { "name": "z.lazy", "signature": "z.lazy(() => Schema)" },
    { "name": "z.optional", "signature": "schema.optional()" },
    { "name": "z.nullable", "signature": "schema.nullable()" },
    { "name": "z.nullish", "signature": "schema.nullish()" },
    { "name": "z.default", "signature": "schema.default(value)" },
    { "name": "z.catch", "signature": "schema.catch(value)" }
  ],
  "transforms_and_refinements": [
    { "name": "refine", "signature": "schema.refine(check, msg|opts)" },
    { "name": "superRefine", "signature": "schema.superRefine((val, ctx) => { ctx.addIssue({...}); })" },
    { "name": "transform", "signature": "schema.transform((val, ctx) => newVal)" },
    { "name": "pipe", "signature": "schema.pipe(otherSchema)" },
    { "name": "preprocess", "signature": "z.preprocess(fn, schema)" },
    { "name": "brand", "signature": "schema.brand<'TypeName'>()" }
  ],
  "parsing": [
    {
      "name": "parse",
      "signature": "schema.parse(data): T",
      "behavior": "失败抛出 ZodError。"
    },
    {
      "name": "safeParse",
      "signature": "schema.safeParse(data): { success: true; data: T } | { success: false; error: ZodError }",
      "behavior": "失败不抛错；推荐用于运行时校验。"
    },
    {
      "name": "parseAsync",
      "signature": "schema.parseAsync(data): Promise<T>",
      "behavior": "适用于带异步 refine/transform 的 schema。"
    },
    {
      "name": "safeParseAsync",
      "signature": "schema.safeParseAsync(data): Promise<{ success, data?, error? }>"
    }
  ],
  "type_inference": {
    "infer": "type T = z.infer<typeof Schema>;",
    "input": "type In = z.input<typeof Schema>;",
    "output": "type Out = z.output<typeof Schema>;"
  },
  "errors": {
    "ZodError": "由 parse 抛出的错误对象，含 issues: ZodIssue[] 与 .format()/.flatten()/.toString()。",
    "common_methods": ["error.issues", "error.format()", "error.flatten()"],
    "ZodIssue_shape": "{ code, path, message, ...specific fields }"
  },
  "patterns_for_tavern_helper_and_mvu": [
    {
      "name": "校验 LLM 返回的工具调用参数",
      "code": "const ToolArgs = z.object({ city: z.string(), unit: z.enum(['c','f']).default('c') }); const result = ToolArgs.safeParse(JSON.parse(text));"
    },
    {
      "name": "校验 MVU stat_data 形状",
      "code": "const Leaf = z.tuple([z.unknown(), z.string()]); const Stat = z.object({ 角色: z.object({ 好感度: Leaf }) });"
    },
    {
      "name": "校验 generate JSON schema 输出",
      "code": "const Schema = z.object({ chapter: z.string(), summary: z.string(), tags: z.array(z.string()) }); const data = Schema.parse(JSON.parse(aiText));"
    },
    {
      "name": "宽松解析（容错+默认值）",
      "code": "const Q = z.object({ qty: z.coerce.number().int().min(1).default(1) }); Q.parse({ qty: '3' });"
    },
    {
      "name": "联合枚举 + 透传未知字段",
      "code": "const Msg = z.object({ role: z.enum(['system','user','assistant']), content: z.string() }).passthrough();"
    }
  ],
  "integration_notes": [
    "JS-Slash-Runner 内置 z；可以直接 z.object({...})，不需要 import。",
    "运行时校验失败时优先用 safeParse 而非 parse，避免脚本崩溃。",
    "对 MVU 的回调里如果要校验 stat_data 子树，先 _.get(...) 再 schema.safeParse(...)。",
    "禁止使用 zod 反序列化用户密钥、口令等敏感字段；只用于结构校验。"
  ]
}
